{
  "schema_version": "node.definition.v1",
  "type_key": "video.frame_apply",
  "contract_version": 5,
  "lifecycle": "ACTIVE",
  "display": {
    "label": "Render full-source motion",
    "description": "원본 전체의 View 중심 경로를 선행 crop 없이 공유 Media Frame에 렌더",
    "category": "Video",
    "icon": "render",
    "cost_label": "$0.00",
    "keywords": ["frame", "full source", "view center", "bezier", "hold", "zoom", "render"]
  },
  "ports": {
    "inputs": [
      { "key": "motion", "type": "data.media_motion.v4", "label": "Full-source Camera Motion", "required": true },
      { "key": "frame", "type": "data.media_frame.v1", "label": "Shared Media Frame", "required": true }
    ],
    "outputs": [{ "key": "video", "type": "media.video.v1", "label": "Framed Clip" }]
  },
  "config_schema": { "type": "object", "additionalProperties": false, "required": [], "properties": {} },
  "binding_policy": { "workflow_inputs": "none" },
  "execution": { "kind": "local", "executor": "video-frame-apply", "revision": "video-frame-apply.v5", "provider": "local", "model_alias": "local.video-frame-apply" },
  "editor": { "kind": "generic" },
  "artifact_contract": { "primary_type": "Video", "schema_id": "video.frame_applied.v5", "input_roles": { "data.media_motion.v4": "motion_plan", "data.media_frame.v1": "media_frame" }, "output_role": "framed_clip" }
}
